{
 "tl_arch": "llama",
 "tl_tokenizer": "bytes",
 "tl_format": 1,
 "vocab_size": 256,
 "hidden_size": 192,
 "intermediate_size": 512,
 "num_hidden_layers": 4,
 "num_attention_heads": 6,
 "num_key_value_heads": 2,
 "max_position_embeddings": 128,
 "rms_norm_eps": 1e-05,
 "rope_theta": 10000.0,
 "tie_word_embeddings": true
}
